topic,size,label,keywords,mk_q,mk_p,mk_tau,mk_trend,burst_max,drift_total_dist,drift_step_mean,drift_robust_score,method,beta_year_z,p,q
73,59,73_artificial_artificial neural_optimization_neural,neural; artificial; algorithm; artificial neural; network; networks; neural networks; training; ann; learning; neural network; elm; algorithms; optimization; activation,0.6490336509901059,0.5747425918205407,-0.0833333333333333,no_trend,,,,,logit,-0.0583176381817119,0.6568500921241809,0.7012318551055444
74,54,74_robot_robots_mobile robot_environment,robot; slam; localization; robots; environment; mobile robot; localization mapping; autonomous; simultaneous localization; sensor; mobile; path planning; inertial; mapping; camera,0.6593405025689827,0.6029682901355149,0.0766666666666666,no_trend,,,,,logit,-0.0286603421913834,0.8344112395881587,0.8451088195828788
75,52,75_translation_machine translation_turkish_morphological,translation; machine translation; turkish; mt; english; machine; language; english turkish; morphological; languages; bleu; statistical machine; sentences; turkish english; tatar,0.0147543080742242,0.0067300352619268,-0.39,decreasing,,,,,logit,-0.4680674546769499,0.0003642597229395,0.0008092124901668
76,52,76_network_plane_networking_controller,sdn; network; software defined; controller; control plane; data plane; plane; energy; data; routing; networks; traffic; defined networks; sdn controller; software,0.004684041986566,0.0017256996792611,0.43,increasing,,,,,logit,0.435458643644535,0.0094470550492851,0.0158790925296494
77,52,77_sound_audio_speech_voice,speaker; speech; sound; audio; speaker recognition; recognition; acoustic; voice; microphone; speaker identification; sounds; signals; lip; mel; speakers,0.6691856916555996,0.6222252922411715,-0.0733333333333333,no_trend,,,,,logit,-0.2641685975520319,0.0443014709890914,0.0648114112618189
78,51,78_testing_test_software_test cases,test; software testing; testing; software; test automation; test cases; mutation; test case; software test; mutation testing; automation; tests; unit testing; software development; cases,0.0655724680832652,0.0385382049261295,0.2933333333333333,increasing,,,,,logit,0.3031972671264658,0.0537524635255227,0.0772080839730236
79,48,79_coloring_scheduling_course_genetic,timetabling; coloring; graph coloring; scheduling; algorithm; course; heuristic; course scheduling; graph; exam; course timetabling; algorithms; genetic; courses; gcp,0.5761311964618696,0.4801093303848913,-0.1033333333333333,no_trend,,,,,,,,
80,48,80_vehicles_routing_ad hoc_hoc,vehicular; routing; vehicles; vanet; vanets; vehicular ad; vehicle; ad hoc; hoc; ad; hoc networks; mobility; network; traffic; networks,0.2066821300907045,0.146853092432869,0.2066666666666666,no_trend,,,,,,,,
81,45,81_ip_voip_protocol_mobile,ipv6; ip; sip; ipv4; voip; protocol; mobile ip; mobile; internet; mobile node; network; internet protocol; routing; voice; ipv4 ipv6,0.0013913438251944,0.0003905526526861,-0.5033333333333333,decreasing,,,,,,,,
82,45,82_layout_visualization_graph_graphs,layout; visualization; graph; graph layout; graphs; layout algorithm; force directed; graph visualization; compound; data; compound graphs; directed layout; complexity management; information visualization; chisio,0.2737471965150288,0.2017084605900212,-0.1833333333333333,no_trend,,,,,,,,
83,44,83_speech_speech recognition_recognition_turkish,speech; speech recognition; recognition; turkish; turkish speech; phoneme; syllable; asr; speaker; word; text speech; text; speech synthesis; phonemes; syllables,0.0655724680832652,0.0383302954238917,-0.2966666666666667,decreasing,,,,,,,,
84,44,84_cloud_virtualization_cloud computing_computing,virtualization; cloud; cloud computing; computing; container; migration; technology; docker; virtual; virtualization technology; technologies; hypervisor; virtualization technologies; physical servers; service,0.0972252955146176,0.0596997428598529,0.27,no_trend,,,,,,,,
85,43,85_encryption_chaotic_image_chaos,encryption; image encryption; chaotic; image; chaos; chaotic maps; images; security; data; algorithm; cryptography; encrypted; chaotic systems; secret; maps,0.9522397566908944,0.9438867763690446,0.0133333333333333,no_trend,,,,,,,,
86,43,86_hiding_secret_cover_message,steganography; lsb; hiding; secret; steganographic; data; image; image steganography; stego; steganalysis; security; information; message; information hiding; images,0.9215112464959792,0.9053443825223656,-0.02,no_trend,,,,,,,,
87,42,87_control_stability_sliding_controller,sliding mode; fractional order; mode control; fractional; sliding; controller; control; mode; order; disturbance; systems; controllers; controller design; stability; design,0.3613402637087479,0.278929326371665,0.1566666666666666,no_trend,,,,,,,,
88,41,88_traffic_transportation_road_travel,traffic; traffic flow; traffic light; road; traffic speed; data; time; intersections; transportation; model; congestion; models; vehicles; prediction; traffic lights,0.019246941609843,0.0094546379837825,0.3566666666666667,increasing,,,,,,,,
89,41,89_eye_hand_interaction_tracking,eye; gaze; eye tracking; pupil; tracking; 3d; interaction; eye gaze; camera; participant; finger; eye tracker; pupil center; computer interaction; human,0.6429754915080788,0.5583734531517526,-0.0866666666666666,no_trend,,,,,,,,
90,40,90_rehabilitation_virtual reality_exercise_reality,rehabilitation; virtual reality; reality; exercise; patients; game; therapy; treatment; virtual; exercises; games; cybersickness; vr; kinect; physical therapy,0.0008216370461156,0.0001945982477642,0.5166666666666667,increasing,,,,,,,,
91,39,91_wireless_security_wireless network_wireless networks,wireless; security; 802; wireless network; wireless networks; network; wireless local; networks; local area; wired; wlan; ieee 802; 802 11; ieee; area network,2.536408214526276e-05,1.113888704384891e-06,-0.69,decreasing,,,,,,,,
92,39,92_fraud_credit_fraud detection_credit card,fraud; credit; credit card; fraud detection; card; card fraud; transactions; insurance; fraudulent; detection; data; learning; credit cards; cards; model,0.0066458837141872,0.0026989314529448,0.4166666666666667,increasing,,,,,,,,
93,38,93_action_actions_human_recognition,action recognition; action; recognition; actions; human actions; videos; human action; human; activity recognition; video; learning; dataset; motion; activity; collective activity,0.0523606449680024,0.0294440148963279,0.3033333333333333,increasing,,,,,,,,
94,38,94_planning_path_path planning_unmanned,planning; path planning; path; uavs; unmanned; uav; flight; aerial; vehicles; vehicle; route; unmanned aerial; mission; altitude; algorithm,0.5590418883619007,0.4575521906224606,0.1066666666666666,no_trend,,,,,,,,
95,37,95_architecture_maintainability_services_software,microservice; microservices; microservice architecture; monolithic; architecture; software; data; microservices architecture; monolithic architecture; services; maintainability; msa; service; microservice architectures; systems,0.0001224314230469,1.3961478066759623e-05,0.55,increasing,,,,,,,,
96,36,96_expressions_mathematical_syntax_programming,expressions; mathematical expressions; symbolic; javacc; mathematical; parser; syntax; interpreter; expression; mathematical expression; symbolic computation; programming; grammar; handwritten mathematical; functional programming,0.1557065799495012,0.1079019282106192,-0.23,no_trend,,,,,,,,
97,36,97_genome_read_dna_reads,sequencing; genome; genomic; read; svs; dna; reads; inversions; alignment; hts; data; duplications; assembly; genomes; segmental duplications,0.0025276897563057,0.0007982178177807,0.4533333333333333,increasing,,,,,,,,
98,36,98_iot_rfid_authentication_security,iot; authentication; security; rfid; protocol; devices; protocols; privacy; internet things; attacks; iot devices; things; internet; authentication protocol; encryption,0.0062145252452774,0.0023985886911597,0.4166666666666667,increasing,,,,,,,,
99,35,99_music_musical_genre_audio,music; melody; musical; genre; genre classification; music genre; monophonic; midi; audio; note; source separation; pitch; compositions; classification; turkish music,0.7011772122138452,0.670423825713238,-0.0633333333333333,no_trend,,,,,,,,
100,35,100_skin_cancer_images_diagnosis,skin; melanoma; skin cancer; cancer; lesion; images; lesions; skin lesions; skin lesion; diagnosis; dermoscopic; classification; learning; isic; dermoscopy,0.0003865939905565,7.460585782670393e-05,0.4866666666666667,increasing,,,,,,,,
101,34,101_question_answering_questions_answer,question answering; answering; question; qa; questions; answer; factoid; answering systems; turkish; natural language; language; answers; qa systems; systems; factoid question,0.0706143676310533,0.0421208508676458,0.2833333333333333,increasing,,,,,,,,
102,34,102_iot_computing_devices_edge,fog; iot; computing; data; devices; cloud; edge; fog computing; offloading; edge computing; internet things; task offloading; things; internet; smart,0.0021267894279514,0.0006529616664763,0.4433333333333333,increasing,,,,,,,,
103,34,103_video_streaming_coding_packet,video; iptv; streaming; raptor; rtp; 264; packet; quic; coding; video coding; network; protocol; quality; intermediate node; quality experience,0.0967680519481015,0.0585701367054298,-0.27,no_trend,,,,,,,,
104,33,104_network_security_ip_packet,firewall; firewalls; network; security; ipsec; packet filtering; packet; packets; ip; virtual private; networks; vpn; virtual; opnet; private network,0.0048681336653065,0.0018362258562121,-0.44,decreasing,,,,,,,,
105,33,105_xml_database_objectoriented_relational,xml; xml documents; data; database; documents; relational; object oriented; catalog; databases; product; object; query; information; xml database; schema,0.0002620573559246,4.1563024106849866e-05,-0.5533333333333333,decreasing,,,,,,,,
106,33,106_posts_social_users_influential,posts; tweets; social; microblogging; users; user; influential; twitter; microblogs; influential user; social networks; information; sentiment; influence; microblog,0.0383941935019928,0.0208810526063469,0.3133333333333333,increasing,,,,,,,,
107,32,107_disease_brain_diagnosis_mri,alzheimer; alzheimer disease; disease; brain; diagnosis; mri; dementia; diagnosis alzheimer; learning; ad; deep learning; neurological; mci; images; deep,0.0039686897734231,0.0013925227275168,0.3933333333333333,increasing,,,,,,,,
108,32,108_path_robots_agents_multiagent,robots; path; agents; agent; path planning; formation control; planning; flock; search; flocking; mapf; robot; algorithm; target search; formation,0.1700225854667536,0.1193140950643885,-0.22,no_trend,,,,,,,,
109,32,109_spectrum_radio_cognitive_channel,cognitive radio; spectrum; radio; cognitive; secondary users; channel; radio networks; secondary; licensed; primary users; users; sus; networks; channel assignment; primary user,0.8498332351940112,0.8200145251872037,-0.0333333333333333,no_trend,,,,,,,,
110,30,110_digital_image_transform_attacks,watermarking; watermark; image; image watermarking; digital watermarking; copyright; images; digital; attacks; copyright protection; watermarked; dwt; fragile; watermarks; fragile watermarking,0.5590418883619007,0.4609643640878831,0.1066666666666666,no_trend,,,,,,,,
111,30,111_automata_finite_quantum_state,automata; automaton; finite automata; finite; quantum; kronecker; turing; turing machines; finite automaton; time; model; verifiers; timed automata; model checking; timed,0.1337511069522656,0.0903406599589864,-0.2366666666666666,no_trend,,,,,,,,
112,30,112_earthquake_disasters_magnitude_natural disasters,earthquake; earthquakes; earthquake prediction; seismic; data; disasters; tweets; shear; prediction; natural disasters; model; lstm; earthquake magnitude; dataset; magnitude,0.4461130727591333,0.3521945311256316,0.13,no_trend,,,,,,,,
113,30,113_websites_attacks_url_malicious,phishing; phishing attacks; attacks; phishing websites; urls; phishing detection; websites; url; learning; malicious; detection; legitimate; social engineering; detecting phishing; classification,0.000134886566449,1.7748232427505783e-05,0.5433333333333333,increasing,,,,,,,,
